FirstName,LastName,Position,District,Party,City,MadisonOffice,Telephones,Fax,DistrictPhone,Email,VotingAddress,Staff,Committees,Biography
Sondy,Pope,,80,D,Mt. Horeb,"Room 118 North\nState Capitol\nP.O. Box 8953\nMadison, WI 53708","(608) 266-3520, (888) 534-0080",(608) 282-3680,,Rep.Pope,"317 Nesheim Trail\nMt. Horeb, WI 53572","Adrian Catacutan, Adelina Yankova;Adelina.Yankova2",Committee on Consumer Protection\nCommittee on Corrections\nCommittee on Education\nCommittee on Rules\nLegislative Council Study Committee on School Data\nSpeaker's Task Force on Urban Education (Vice-Chair),"Born Madison, April 27, 1950; married.  Graduate River Valley H.S.; attended Madison Area Technical College and Edgewood College.  Former Associate Director of the Foundation for Madison's Public Schools.  Member: Natl. Caucus of Environmental Legislators; Honorary Life Member, Wis. Congress of Parents and Teachers; Midwestern Higher Education Compact Commission; Fellow, Bowhay Institute, La Follette School, UW-Madison; Fellow, Flemming Institute, Center for Policy Alternatives; Oakhill Correctional Institute Advisory Bd.\nElected to Assembly since 2002.",http://docs.legis.wisconsin.gov/2015/legislators/assembly/1313,http://legis.wisconsin.gov/assembly/pope/
Romaine,Quinn,,75,R,Rice Lake,"Room 7 West\nState Capitol\nP.O. Box 8953\nMadison, WI 53708","(608) 266-2519, (888) 534-0075",(608) 282-3675,,Rep.Quinn,"256 24 3/4 Street\nChetek, WI 54728","Ericka Braatz, Steven Schwerbel",Committee on Aging and Long-Term Care (Vice-Chair)\nCommittee on Colleges and Universities\nCommittee on Education\nCommittee on Mining and Rural Development\nCommittee on Natural Resources and Sporting Heritage (Vice-Chair)\nCommittee on Urban and Local Affairs,"Born Rice Lake, July 30, 1990.  Graduate Rice Lake H.S. 2009; interdisciplinary degree (B.A.), political science with emphasis on public leadership, UW Green Bay 2014; attended UW-Barron Co. and UW-Eau Claire.  Full-time legislator.  Former salesman and waiter.  Rice Lake City Council 2009-10; Mayor of Rice Lake 2010-12.\nElected to Assembly 2014.  Member of Sporting Heritage Council",http://docs.legis.wisconsin.gov/2015/legislators/assembly/1357,http://legis.wisconsin.gov/assembly/75/Quinn
Daniel,Riemer,,7,D,Milwaukee,"Room 122 North\nState Capitol\nP.O. Box 8953\nMadison, WI 53708","(608) 266-1733, (888) 529-0007",(608) 282-3607,,Rep.Riemer,"3022 South 39th Street\nMilwaukee, WI 53215","Dave Groshek, Michael Ingalls",Committee on Health\nCommittee on Mental Health Reform\nCommittee on Veterans and Military Affairs\nCommittee on Ways and Means\nCommittee on Workforce Development\nLaw Revision Committee,"Born Milwaukee, December 10, 1986; single.  Graduate Rufus King H.S. (Milwaukee) 2005; B.A. U. of Chicago 2009; J.D. U. of Wisconsin Law School 2013.  Full-time legislator.  Member:  Wis. State Bar Assn.; World Economic Forum: Global Shapers, Milwaukee Hub.\nElected to Assembly 2012; reelected 2014.  Member of Uniform State Laws, Commission on",http://docs.legis.wisconsin.gov/2015/legislators/assembly/1240,http://legis.wisconsin.gov/assembly/07/riemer
Keith,Ripp,,42,R,Lodi,"Room 223 North\nState Capitol\nP.O. Box 8953\nMadison, WI 53708","(608) 266-3404, (888) 534-0042",(608) 282-3642,,Rep.Ripp,"7113 County Rd. V\nLodi, WI 53555","Matthew Rohrbeck, Colette Shepherd-Bussan",Committee on Agriculture\nCommittee on Natural Resources and Sporting Heritage\nCommittee on State Affairs and Government Operations\nCommittee on Transportation (Chair)\nCommittee on Workforce Development,"Born Madison, November 13, 1961; married; 3 children.  Graduate Lodi H.S. 1980; UW-Madison farm and industry short course 1981.  Farmer and small business owner.  Member: Wis. Soybean Marketing Bd. (fmr. pres., vice pres.); Badger Agvest LLC (fmr. pres. and co-founder); Wis. Corn Growers Assn. (fmr. pres., vice pres.); Wis. Farm Bureau; Lodi FFA Alumni (fmr. pres., co-founder); Columbia and Dane Co. Republican Party; Yellow Thunder Snowmobile Club; Ducks Unlimited.  Town of Dane Supervisor 2006-08.\nElected to Assembly 2008; reelected since 2010.",http://docs.legis.wisconsin.gov/2015/legislators/assembly/1275,http://legis.wisconsin.gov/assembly/ripp
Jessie,Rodriguez,Majority Caucus Secretary,21,R,Oak Creek,"Room 204 North\nState Capitol\nP.O. Box 8953\nMadison, WI 53708","(608) 266-0610, (888) 534-0021",(608) 282-3621,,Rep.Rodriguez,"6633 S. Crane Drive\nOak Creek, WI 53154","Nick Bentz, Katelyn Schultz",Committee on Children and Families (Chair)\nCommittee on Colleges and Universities\nCommittee on Criminal Justice and Public Safety\nCommittee on Education\nCommittee on Mental Health Reform\nSpeaker's Task Force on Urban Education (Chair),"Born Puerto el Triunfo, El Salvador, July 5, 1977; married.  Graduate Alexander Hamilton H.S. (Milwaukee) 1996; B.A. Marquette U. 2002.  Full-time legislator.  Former analyst for a supermarket company; outreach coordinator for Hispanics for School Choice.\n\nElected to Assembly in November 2013 special election; reelected 2014.  Member of Milwaukee Child Welfare Partnership Council",http://docs.legis.wisconsin.gov/2015/legislators/assembly/1254,http://legis.wisconsin.gov/assembly/rodriguez/
Mike,Rohrkaste,,55,R,Neenah,"Room 208 North\nState Capitol\nP.O. Box 8953\nMadison, WI 53708","(608) 266-5719, (888) 534-0055",(608) 282-3655,,Rep.Rohrkaste,"1417 Mahler Blvd.\nNeenah, WI 54956","Tyler Clark, Matt Pulda",Committee on Colleges and Universities\nCommittee on Health (Vice-Chair)\nCommittee on Interstate Affairs\nCommittee on Jobs and the Economy\nCommittee on Mental Health Reform\nSpeaker's Task Force on Alzheimer's and Dementia (Chair),"Born Dayton, Ohio, September 24, 1958; married; 2 children.  Graduate Chaminade-Julienne H.S. (Dayton, Ohio) 1976; B.S. Michigan St. U. 1980; Masters in labor and industrial relations Michigan St. U. 1982.  Full-time legislator.  Former chief human resources officer, vice president of human resources; over 30 years' business/human resources experience.  Member: YMCA of Fox Cities (bd. mbr.); Samaritans Counseling Center Fox Valley (bd. mbr.); Neenah Club; Fox Cities Morning Rotary (chair, vocational com.).  Former member: Fox Valley Christian Academy (bd. mbr.); Calvary Bible Church.\nElected to Assembly 2014.",http://docs.legis.wisconsin.gov/2015/legislators/assembly/1351,http://legis.wisconsin.gov/assembly/55/rohrkaste
Joe,Sanfelippo,,15,R,New Berlin,"Room 306 North\nState Capitol\nP.O. Box 8953\nMadison, WI 53708","(608) 266-0620, (888) 534-0015",(608) 282-3615,,Rep.Sanfelippo,"20770 W. Coffee Rd.\nNew Berlin, WI 53146",Joshua Hoisington,Committee on Campaigns and Elections\nCommittee on Financial Institutions\nCommittee on Health (Chair)\nCommittee on Mental Health Reform\nCommittee on Transportation,"Born Milwaukee February 26, 1964; married; 3 children.  Graduate Thomas More H.S. 1982; attended Marquette U. 1982-84.  Small businessman; currently operates a small Christmas tree farm.  Owned and operated a landscaping business for 20 years.  Member: Mary Queen of Heaven Catholic Church, West Allis and St. John the Evangelist Parish, Greenfield.  Milwaukee County Bd. of Supervisors 2008-12.\nElected to Assembly 2012; reelected 2014.Member of Highway Safety, Council on",http://docs.legis.wisconsin.gov/2015/legislators/assembly/1248,http://legis.wisconsin.gov/assembly/sanfelippo
Melissa,Sargent,,48,D,Madison,"Room 321 West\nState Capitol\nP.O. Box 8953\nMadison, WI 53708",(608) 266-0960,(608) 282-3648,,Rep.Sargent,"1638 Mayfield Ln.\nMadison, WI 53704","Aaron Collins, Hayley Young",Committee on Aging and Long-Term Care\nCommittee on Audit\nCommittee on Energy and Utilities\nCommittee on Financial Institutions\nCommittee on Mental Health Reform\nCommittee on Small Business Development\nJoint Legislative Audit Committee,"Born Madison, March 28, 1969; married; 4 sons.  Graduate Madison East H.S. 1987; B.A. UW-Madison 1991.  Graduate Bowhay Inst. for Legislative Leadership Dev.; Emerging Leader program, U. of Virginia, 2014.  Small business owner.  Member: Women in Government (state dir.); WiLL/WAND (state dir.); Emerge Wis. (bd. of dir.); Dane Co. Democratic Party; Wis. League of Conservation Voters; Sierra Club; Democratic Party; Wis. Business Alliance; Emerge Wis.; NARAL Pro-Choice Wis.; Make Room for Youth; Friends of Cherokee Marsh.  Former member: Midwest Shiba Inu Dog Rescue (pres.); Gompers PTO (pres.).  Recipient: National Federation of Women Legislators Woman of Excellence; Arc Dane Co. Elected Official of the Year 2014; Citizen Action Activist Achievement Award 2014; Eleanor Roosevelt Award nominee 2013; Wis. League of Conservation Voters Conservation Champion 2014.  Dane Co. Bd. of Supervisors 2010-14.\nElected to Assembly 2012; reelected 2014.",http://docs.legis.wisconsin.gov/2015/legislators/assembly/1281,http://legis.wisconsin.gov/assembly/sargent
Michael,Schraa,,53,R,Oshkosh,"Room 320 East\nState Capitol\nP.O. Box 8953\nMadison, WI 53708","(608) 267-7990, (888) 534-0053",(608) 282-3653,,Rep.Schraa,"2834 County Road FF\nOshkosh, WI 54904",Trevor Ford,Committee on Finance\nCommittee on Public Benefit Reform\nJoint Committee on Finance,"Born Fort Carson, CO, April 17, 1961; married; 3 children.  Graduate Oshkosh North H.S. 1979; attended UW-Oshkosh 1980-82.  Restaurant owner.  Former stock broker/investment advisor.  Member: Winnebago Co. Republican Party (ex. bd.); Fond du Lac Co. Republican Party; Southwest Rotary (Oshkosh); Oshkosh Chamber of Commerce; Portico Church (Oshkosh); Wis. Ind. Business; NRA.  Former member: Fond du Lac Co. Farm Bureau; NFIB; Oshkosh Jaycees; Big Brothers/Big Sisters; Exchange Club.\nElected to Assembly 2012; reelected 2014.",http://docs.legis.wisconsin.gov/2015/legislators/assembly/1286,http://legis.wisconsin.gov/assembly/schraa
Katrina,Shankland,Assistant Minority Leader,71,D,Stevens Point,"Room 119 North\nState Capitol\nP.O. Box 8953\nMadison, WI 53708","(608) 267-9649, (888) 534-0071",(608) 282-3671,,Rep.Shankland,"5782 Sandpiper Drive\nStevens Point, WI 54482","David Harms, Annika Petty, Alexandria Turner;Alexandria.Turner2, Mike VanDenHeuvel",Committee for Review of Administrative Rules\nCommittee on Assembly Organization\nCommittee on Natural Resources and Sporting Heritage\nCommittee on Rules\nCommittee on Workforce Development\nJoint Committee on Legislative Organization\nJoint Legislative Council\nSpeaker's Task Force on Youth Workforce Readiness (Vice-Chair),"Born Wausau, August 4, 1987; single.  Graduate Wittenberg-Birnamwood H.S. 2005; B.A. political science UW-Madison 2009; attended UW-Marathon Co. 2004-05, Marquette U. 2005-06.  Full-time legislator.  Former nonprofit professional.  Member: National Caucus of Environmental Legislators; Young Elected Officials Network; Council of State Governments Henry Toll Fellow, 2013; Midwest Renewable Energy Assn.; Clean Wisconsin; Portage Co. Business Council; Central Rivers Farmshed; Portage Co. Democratic Party.\nElected to Assembly 2012; reelected 2014.  Assistant Minority Leader 2015.",http://docs.legis.wisconsin.gov/2015/legislators/assembly/1304,http://legis.wisconsin.gov/assembly/shankland
Christine,Sinicki,,20,D,Milwaukee,"Room 114 North\nState Capitol\nP.O. Box 8953\nMadison, WI 53708","(608) 266-8588, (888) 534-0020",(608) 282-3620,(414) 481-7667,Rep.Sinicki,"3132 South Indiana Avenue\nMilwaukee, WI 53207","Mary Beth George;marybeth.george, Mike Pearson;Mike.Pearson2",Committee on Consumer Protection\nCommittee on Education\nCommittee on Labor\nCommittee on State Affairs and Government Operations\nCommittee on Veterans and Military Affairs\nSpeaker's Task Force on Urban Education,"Born Milwaukee, March 28, 1960; married; 2 children.  Graduate Bay View H.S.  Former small business manager.  Member: Delegate-U.S. Pres. Electoral College, 2000; Amer. Coun. of Young Political Leaders, Delegate to Israel and Palestine, 2001; Milw. Com. on Domestic Violence and Sexual Assault; Wis. Civil Air Patrol, Major; Milw. City Coun. Parents and Teachers Assn.; Bay View Historical Soc.; Bay View Neighborhood Assn.; Fellow, Bowhay Institute, La Follette School, UW-Madison 2001; Flemming Fellow, Center for Policy Alternatives 2003.  Awards: Wis. Environmental Decade Clean 16 2000; Wis. Ob/Gyn Physicians' Legislator of the Year 2000; Wis. Coalition Against Domestic Violence DV Diva 2003; Wis. Dept. of Veterans Affairs Certificates of Commendation 2006, 2005; Wis. League of Conservation Voters Conservation Champion 2014, 2011, 2009, 2007; Wis. Women's Alliance Legislation Award 2009-10; Professional Firefighters of Wis. Legislator of the Year 2010; Wis. Grocers Assn. Friend of Grocers 2010; Cudahy Veterans' Service Award 2010; AMVETS State Legislative Advocacy Award 2011.  Assembly Democratic Task Force on Working Families (chp.) 2003.  State Assembly Milw. Caucus (chp. 2005, 2003).  Dept. of Workforce Development State Minimum Wage Council (gov. appointee) 2005.  Milw. School Board 1991-98.\nElected to Assembly since 1998.  Minority Caucus Secretary 2001.",http://docs.legis.wisconsin.gov/2015/legislators/assembly/1253,http://legis.wisconsin.gov/assembly/sinicki
Ken,Skowronski,,82,R,Franklin,"Room 209 North\nState Capitol\nP.O. Box 8953\nMadison, WI 53708","(608) 266-8590, (888) 534-0082",(608) 282-3682,,Rep.Skowronski,"8642 South 116 Street\nFranklin, WI 53132","Sarah Gibbs, Justin Phillips",Committee on Health\nCommittee on Natural Resources and Sporting Heritage\nCommittee on Small Business Development\nCommittee on Urban and Local Affairs\nCommittee on Veterans and Military Affairs (Chair),"Born Milwaukee, May 31, 1938; widowed; 2 children.  Graduate Boys Tech H.S. 1958.  Journeyman carpenter, MATC (Milwaukee) 1961; NARI certified remodeler.  General contractor; radio host, monthly talk show; 4H construction skills instructor; seminar speaker, Wis. Burglar and Fire Alarm Assn. and WPR.  Wis. Air National Guard 1956-62.  Member: Milwaukee/NARI Foundation (trustee; fmr. pres.); Franklin Noon Lions Club (trustee, fmr. pres.); Polish Heritage Alliance (bd. mbr.); Knights of Columbus (fmr. deputy grand knight); National Rifle Assn. (endowment life mbr.); Ducks Unlimited (life mbr.); Rocky Mountain Elk Foundation (life mbr.); South Suburban Chamber of Commerce (fmr. bd. mbr.); Milwaukee/NARI Chapter (fmr. pres.); NARI National Foundation/NRF (fmr. pres.).  Former member: Franklin Lions Club (pres.); NKBA Wis./Upper Michigan Chapter (treas.); City of Franklin Plan Commission; City of Franklin Economic Dev. Commission (chm.); City of Franklin Community Development Authority; City of Franklin 50th Anniversary Com. (chm.).  Recipient: City of Franklin Distinguished Service Award 1983; Lions Intl. Melvin Jones Fellowship Award 1995; Remodeling Magazine Big 50 Industry Impact Award 1992; National Brand Names Foundation First Place Remodelers Award 1972; Milwaukee/NARI Chapter Hank Fenderbosh Award 1995,  Harold Hammerman Award (nominee) 1994-95, Lifetime Achievement Award 2002, 1997.  Alderman, City of Franklin 2005-14. \nElected to Assembly in December 2013 special election; reelected 2014.",http://docs.legis.wisconsin.gov/2015/legislators/assembly/1315,http://legis.wisconsin.gov/assembly/skowronski
John,Spiros,,86,R,Marshfield,"Room 15 North\nState Capitol\nP.O. Box 8953\nMadison, WI 53708","(608) 266-1182, (888) 534-0086",(608) 282-3686,,Rep.Spiros,"1406 E. Fillmore\nMarshfield, WI 54449","Meagan Matthews, Erin Mellon",Committee on Criminal Justice and Public Safety\nCommittee on Labor (Vice-Chair)\nCommittee on Transportation (Vice-Chair)\nCommittee on Ways and Means (Chair)\nLegislative Council Study Committee on Publication of Government Documents and Legal Notices (Chair)\nSpeaker's Task Force on Youth Workforce Readiness,"Born Akron, Ohio, July 28, 1961; married; 5 children, 2 grandchildren.  Graduate Marietta H.S. (Marietta, Ohio) 1979; A.A.S. criminal justice MTCC (Omaha, NE) 1985.  Vice president, safety and claims management for a transport company.  Served in U.S. Air Force 1979-85.  Member: Trucking Industry Defense Assn. (bd. mbr.); Wis. Farm Bureau; Marshfield Elks Club.  Former member: Marshfield Rotary Club.  City of Marshfield Alderman 2005-13.\nElected to Assembly 2012; reelected 2014.",http://docs.legis.wisconsin.gov/2015/legislators/assembly/1319,http://legis.wisconsin.gov/assembly/spiros/
Mark,Spreitzer,,45,D,Beloit,"Room 420 North\nState Capitol\nP.O. Box 8953\nMadison, WI 53708","(608) 266-1192, (888) 534-0045",(608) 282-3645,,Rep.Spreitzer,"1718 Henderson Ave.\nBeloit, WI 53511","Mark Bender, Bradford Steine",Committee on Jobs and the Economy\nCommittee on Mining and Rural Development\nCommittee on Natural Resources and Sporting Heritage\nCommittee on Public Benefit Reform\nCommittee on Workforce Development\nJoint Committee for Review of Administrative Rules\nLegislative Council Study Committee on Rural Broadband\nSpeaker's Task Force on Youth Workforce Readiness,"Born Evanston, Ill., December 16, 1986; single.  Graduate Northside College Preparatory H.S. (Chicago, Ill.) 2005; B.A. political science Beloit College 2009.  Full-time legislator.  Former assistant director of alumni and parent relations and annual support, Beloit College.  Member: United Church of Beloit (deacon's bd.); Welty Environmental Center; Wis. League of Conservation Voters; Fair Wisconsin; Democratic Party of Rock Co.; Greater Beloit Chamber of Commerce Rising Professionals; Youth2Youth 4 Change Coalition.  Former member: Community Action, Inc. of Rock and Walworth Cos. (bd. mbr.); Lifecourse Initiative for Healthy Families. City of Beloit Appointment Review Com. (chp.).  Beloit City Council 2011-15, president 2014-15. \nElected to Assembly 2014.  Member of Transportation Projects Commission",http://docs.legis.wisconsin.gov/2015/legislators/assembly/1350,http://legis.wisconsin.gov/assembly/45/spreitzer
David,Steffen,,4,R,Green Bay,"Room 21 North\nState Capitol\nP.O. Box 8953\nMadison, WI 53708","(608) 266-5840, (888) 534-0004",(608) 282-3604,,Rep.Steffen,"1320 Sunray Lane\nGreen Bay, WI 54313",Nicole Walentowski,Committee on Energy and Utilities (Vice-Chair)\nCommittee on Insurance\nCommittee on Jobs and the Economy\nCommittee on Urban and Local Affairs\nCommittee on Ways and Means,"Born October 12, 1971; married; 1 child.  Graduate Ashwaubenon H.S. 1990; B.A. political science UW-Madison 1995.  Small business owner.  Former external affairs director and government affairs representative.  Member: Howard Small Business Partnership (founder, vice chp.); Howard Go Green Save Green Initiative (founder, chp.); Ashwaubenon Business Assn. (pres.); Prevent Blindness - Northeastern Wis. (pres.); Team Lambeau (ex. dir.); Green Bay Area Chamber of Commerce State and Federal Issues Com. (chp.).  Village of Howard Bd. of Trustees 2007-15; Brown Co. Bd. of Supervisors 2012-15.\nElected to Assembly 2014.",http://docs.legis.wisconsin.gov/2015/legislators/assembly/1341,http://legis.wisconsin.gov/assembly/04/steffen
Jim,Steineke,Majority Leader,5,R,Kaukauna,"Room 115 West\nState Capitol\nP.O. Box 8953\nMadison, WI 53708","(608) 266-2418, (888) 534-0005",(608) 282-3605,,Rep.Steineke,,"Bonnie Deering, Bob Karius, Michael Luckey, Rusty Schultz",Committee on Assembly Organization (Vice-Chair)\nCommittee on Employment Relations\nCommittee on Rules (Chair)\nJoint Committee on Employment Relations\nJoint Committee on Legislative Organization\nJoint Legislative Council,"Born Milwaukee, November 23, 1970; married, 3 children.  Graduate Wauwatosa West H.S. 1989; attended UW-Milwaukee and UW-Oshkosh.  Realtor, salesman.  Member:  Realtors Assn. of Northeast Wis.; Wis. Realtors Assn.  Town supervisor, Town of Vandenbroeck 2005-07; town chp. 2007-11. Outagamie Co. supervisor 2006-11. \nElected to Assembly 2010; reelected since 2012.  Majority Leader 2015; Assistant Majority Leader 2013.",http://docs.legis.wisconsin.gov/2015/legislators/assembly/1238,http://legis.wisconsin.gov/assembly/05/steineke
Amanda,Stuck,,57,D,Appleton,"Room 4 West\nState Capitol\nP.O. Box 8953\nMadison, WI 53708","(608) 266-3070, (888) 534-0057",(608) 282-3657,,Rep.Stuck,"1404 N. Harriman St.\nAppleton, WI 54911",Eric Koch,Committee on Energy and Utilities\nCommittee on Environment and Forestry\nCommittee on Housing and Real Estate\nCommittee on Jobs and the Economy\nLegislative Council Study Committee on Access to Civil Legal Services,"Born Appleton, December 16, 1982; married; 2 children.  Graduate Appleton North H.S. 2001; B.A. political science UW-Oshkosh 2007; Masters of public administration UW-Oshkosh 2012.  Full-time legislator.  Former housing specialist, Appleton Housing Authority; legislative aide, Cong. Steve Kagan; rural mail carrier.\nElected to Assembly 2014.",http://docs.legis.wisconsin.gov/2015/legislators/assembly/1352,http://legis.wisconsin.gov/assembly/57/stuck
Lisa,Subeck,,78,D,Madison,"Room 418 North\nState Capitol\nP.O. Box 8953\nMadison, WI 53708","(608) 266-7521, (888) 534-0078",(608) 282-3678,,Rep.Subeck,"818 S. Gammon Rd. #4\nMadison, WI 53719",Zachary Madden,Committee on Children and Families\nCommittee on Family Law\nCommittee on Health\nCommittee on Public Benefit Reform\nCommittee on Urban and Local Affairs\nLegislative Council Study Committee on Access to Civil Legal Services,"Born Chicago, Ill., June 17, 1971; single.  Graduate Rich Central H.S. 1989; B.A. UW-Madison 1993.  Full-time legislator.  Former early childhood education/Head Start program manager; technical college instructor; nonprofit executive director.  Former member: Am. Federation of Teachers.  City of Madison Common Council 2011-15.\nElected to Assembly 2014.",http://docs.legis.wisconsin.gov/2015/legislators/assembly/1358,http://legis.wisconsin.gov/assembly/78/subeck
Rob,Swearingen,,34,R,Rhinelander,"Room 123 West\nState Capitol\nP.O. Box 8953\nMadison, WI 53708","(608) 266-7141, (888) 534-0034",(608) 282-3634,,Rep.Swearingen,"4485 Oakview Ln.\nRhinelander, WI 54501",Matt Wimmer,Committee on Environment and Forestry\nCommittee on Small Business Development\nCommittee on State Affairs and Government Operations (Chair)\nCommittee on Tourism\nCommittee on Transportation\nJoint Survey Committee on Tax Exemptions\nSpeaker's Task Force on Youth Workforce Readiness,"Born Oneida Co., July 23, 1963; married; 2 children.  Graduate Rhinelander H.S. 1981.  Restaurant owner/operator.  Member: Tavern League of Wisconsin (former pres., zone vice pres., district director); American Beverage Licensees (former member, bd. of dir.); Oneida Co. Tavern League (former pres., vice pres.); Rhinelander Chamber of Commerce; Oneida County Republican Party.\nElected to Assembly 2012; reelected 2014.  Member of Building Commission",http://docs.legis.wisconsin.gov/2015/legislators/assembly/1267,http://legis.wisconsin.gov/assembly/swearingen
Gary,Tauchen,,6,R,Bonduel,"Room 13 West\nState Capitol\nP.O. Box 8953\nMadison, WI 53708","(608) 266-3097, (888) 529-0006",(608) 282-3606,,Rep.Tauchen,"N3397 S. Broadway Road\nBonduel, WI 54107","Craig Arrowood, Derrick Scherdell",Committee on Agriculture\nCommittee on Jobs and the Economy\nCommittee on Public Benefit Reform\nCommittee on Small Business Development (Chair)\nCommittee on State Affairs and Government Operations\nCommittee on Tourism,"Born Rice Lake, November 23, 1953; single.  Graduate Bonduel H.S. 1971; attended UW-Madison 1971-72; B.S. in Animal Science, UW-River Falls 1976.  Dairy farmer.  Member: Wis. Farm Bureau; Badger AgVest, LLC (dir.); Professional Dairy Producers of Wis. (fmr. dir.); Dairy Business Assn.; Wis. Livestock Identification Consortium (fmr. dir., fmr. chm.); Brown, Shawano, Outagamie, Waupaca Co. Republican Party; Shawano Area Chamber of Commerce; Shawano Co. Dairy Promotions (fmr. dir.); Cooperative Resources International (fmr. vice chm.); AgSource Cooperative Services (fmr. chm.); National Dairy Herd Improvement Assn. (fmr. dir.); UW Center for Dairy Profitability (fmr. chm.); Shawano Rotary.\nElected to Assembly 2006; reelected since 2008.  Minority Caucus Sergeant at Arms 2009.",http://docs.legis.wisconsin.gov/2015/legislators/assembly/1239,
Jeremy,Thiesfeldt,,52,R,Fond du Lac,"Room 16 West\nState Capitol\nP.O. Box 8953\nMadison, WI 53708","(608) 266-3156, (888) 529-0052",(608) 282-3652,,Rep.Thiesfeldt,"604 Sunset Lane\nFond du Lac, WI 54935","Hannah Gibbs, Hariah Hutkowski",Committee on Campaigns and Elections\nCommittee on Education (Chair)\nCommittee on Family Law\nCommittee on Judiciary\nCommittee on Transportation\nLegislative Council Study Committee on School Data (Chair)\nSpeaker's Task Force on Urban Education,"Born Fond du Lac, November 22, 1966; married; 4 children.  Graduate Kettle Moraine Lutheran H.S. (Jackson) 1985; B.S. Elementary education Dr. Martin Luther College 1989, attended U. of Minnesota 1992.  Full-time legislator.  Former teacher.  Member: Fond du Lac Noon Rotary; Fond du Lac County Rep. Party; Redeemer Lutheran Church, Thrivent Financial; National Rifle Association; Fond du Lac Assn. of Commerce; Leadership Fond du Lac; Young Professionals of Fond du Lac; Wis. Farm Bureau.  Former member: Camp Croix; Minnesota District Lutheran Teachers' Conf.; Wisconsin Lutheran State Teachers' Conf.; Wisconsin Area Lutheran Educators' Conf.  Fond du Lac city council 2005-10.\nElected to Assembly 2010; reelected since 2012.",http://docs.legis.wisconsin.gov/2015/legislators/assembly/1285,http://legis.wisconsin.gov/assembly/thiesfeldt/
